"DESCRIPTION","DURATION IN MS","NAME","PARENT SUITE","START TIME","STATUS","STOP TIME","SUB SUITE","SUITE","TEST CLASS","TEST METHOD"
"","1659","Retrieve all activities details (retrieve all the activity details)","","2026-04-27","passed","2026-04-27","","FakeRest API Activities","Retrieve all activities details (retrieve all the activity details)",""
"","509","Create the books details","","2026-04-27","passed","2026-04-27","","FakeRest API Books","Create the books details",""
"","1781","Retrieve the all books details","","2026-04-27","passed","2026-04-27","","FakeRest API Books","Retrieve the all books details",""
"","503","Retrieve the specific activity id","","2026-04-27","passed","2026-04-27","","FakeRest API Activities","Retrieve the specific activity id",""
"","528","Create the activities details","","2026-04-27","passed","2026-04-27","","FakeRest API Activities","Create the activities details",""
