"DESCRIPTION","DURATION IN MS","NAME","PARENT SUITE","START TIME","STATUS","STOP TIME","SUB SUITE","SUITE","TEST CLASS","TEST METHOD"
"","538","Create the activities details","","2026-04-11","passed","2026-04-11","","FakeRest API Activities","Create the activities details",""
"","747","Retrieve the all books details","","2026-04-11","passed","2026-04-11","","FakeRest API Books","Retrieve the all books details",""
"","1676","Retrieve all activities details (retrieve all the activity details)","","2026-04-11","passed","2026-04-11","","FakeRest API Activities","Retrieve all activities details (retrieve all the activity details)",""
"","451","Create the books details","","2026-04-11","passed","2026-04-11","","FakeRest API Books","Create the books details",""
"","442","Retrieve the specific activity id","","2026-04-11","passed","2026-04-11","","FakeRest API Activities","Retrieve the specific activity id",""
